{
  "$schema": "https://raw.githubusercontent.com/dkharlanau/agent-ready-web-profile/main/schema/portfolio-sites.schema.json",
  "version": "0.1",
  "updatedAt": "2026-10-25",
  "description": "Owner-controlled rollout portfolio for applying reviewed ARWP Growth trends to relevant public surfaces. Membership is operational metadata, not independent adoption evidence or a quality ranking.",
  "guardrails": {
    "ownerControlledEvidence": true,
    "watchIsNotDefaultRollout": true,
    "siteAuditRequiredBeforeMutation": true,
    "noProductionMutation": true,
    "noRankingInference": true
  },
  "sites": [
    {
      "id": "dkharlanau-sap-knowledge",
      "name": "Dzmitryi Kharlanau — SAP Knowledge",
      "canonicalUrl": "https://dkharlanau.github.io/",
      "repository": "dkharlanau/dkharlanau.github.io",
      "githubPages": {
        "kind": "user-site-root",
        "hostnameRoot": "https://dkharlanau.github.io/",
        "independentSearchIdentity": true
      },
      "verticals": ["documentation", "editorial", "software-product"],
      "goals": ["search", "generative-search", "ai-citations", "acquisition", "measurement", "agent-usability", "agent-discovery"],
      "rollout": { "enabled": true, "mode": "managed-issue" }
    },
    {
      "id": "ptichi-fresh-site",
      "name": "Ptichi",
      "canonicalUrl": "https://ptichi.com/",
      "repository": "dkharlanau/ptichi-site",
      "verticals": ["software-product", "documentation", "editorial", "research-dataset"],
      "goals": ["search", "generative-search", "ai-citations", "acquisition", "measurement", "agent-usability", "agent-discovery"],
      "rollout": { "enabled": true, "mode": "proposal-only" }
    },
    {
      "id": "metalhatscats-applied-systems",
      "name": "MetalHatsCats",
      "canonicalUrl": "https://metalhatscats.com/",
      "repository": "metalhatscats/mhc",
      "verticals": ["software-product", "documentation", "editorial", "research-dataset"],
      "goals": ["search", "generative-search", "ai-citations", "acquisition", "measurement", "agent-usability", "agent-discovery"],
      "rollout": { "enabled": true, "mode": "observe-only" }
    },
    {
      "id": "metkagram-language-knowledge",
      "name": "Metkagram",
      "canonicalUrl": "https://metkagram.github.io/",
      "repository": "metkagram/metkagram.github.io",
      "githubPages": {
        "kind": "organization-site-root",
        "hostnameRoot": "https://metkagram.github.io/",
        "independentSearchIdentity": true
      },
      "verticals": ["software-product", "documentation", "research-dataset"],
      "goals": ["search", "generative-search", "ai-citations", "acquisition", "measurement", "agent-usability", "agent-discovery"],
      "rollout": { "enabled": true, "mode": "managed-issue" }
    },
    {
      "id": "brali-practical-knowledge",
      "name": "Brali Practical Knowledge Library",
      "canonicalUrl": "https://brali-lifeos.github.io/",
      "repository": "Brali-LifeOS/brali-lifeos.github.io",
      "githubPages": {
        "kind": "organization-site-root",
        "hostnameRoot": "https://brali-lifeos.github.io/",
        "independentSearchIdentity": true
      },
      "verticals": ["editorial", "documentation"],
      "goals": ["search", "generative-search", "ai-citations", "acquisition", "measurement", "agent-discovery"],
      "rollout": { "enabled": true, "mode": "proposal-only" }
    },
    {
      "id": "cognitive-biases-knowledge",
      "name": "Cognitive Biases Knowledge Library",
      "canonicalUrl": "https://cognitive-biases.github.io/",
      "repository": "Cognitive-Biases/cognitive-biases.github.io",
      "githubPages": {
        "kind": "organization-site-root",
        "hostnameRoot": "https://cognitive-biases.github.io/",
        "independentSearchIdentity": true
      },
      "verticals": ["editorial", "research-dataset"],
      "goals": ["search", "generative-search", "ai-citations", "acquisition", "measurement", "agent-discovery"],
      "rollout": { "enabled": true, "mode": "managed-issue" }
    },
    {
      "id": "vedokrok-practical-learning",
      "name": "Vedokrok",
      "canonicalUrl": "https://vedokrok.com/",
      "repository": "dkharlanau/vedokrok",
      "verticals": ["software-product", "editorial", "research-dataset"],
      "goals": ["search", "generative-search", "ai-citations", "acquisition", "measurement", "agent-usability", "agent-discovery"],
      "rollout": { "enabled": true, "mode": "observe-only" }
    },
    {
      "id": "bonihua-chinese-learning",
      "name": "Bonihua",
      "canonicalUrl": "https://www.bonihua.com/",
      "repository": "metalhatscats/bonihua",
      "verticals": ["editorial", "software-product"],
      "goals": ["search", "generative-search", "ai-citations", "acquisition", "measurement", "agent-usability", "agent-discovery"],
      "rollout": { "enabled": true, "mode": "observe-only" }
    },
    {
      "id": "cbt-cards-public-reflection",
      "name": "CBT Cards Public Reflection Resource",
      "canonicalUrl": "https://cbt-cards.github.io/",
      "repository": "CBT-cards/cbt-cards.github.io",
      "githubPages": {
        "kind": "organization-site-root",
        "hostnameRoot": "https://cbt-cards.github.io/",
        "independentSearchIdentity": true
      },
      "verticals": ["editorial", "research-dataset"],
      "goals": ["search", "generative-search", "ai-citations", "acquisition", "measurement", "agent-discovery"],
      "rollout": { "enabled": true, "mode": "proposal-only" }
    }
  ]
}
